nombre,provincia,web,email,telefono
Danza Lía,Asturias,https://escueladedanzalia.com,,
Escuela de Danza Inma Muñoz,Castellón,https://inmadanza.es,escuela@inmadanza.es,
Escuela de Danza Montse,Valencia,https://escueladedanzamontse.es,,
En Clave de Danza,Málaga,https://enclavededanza.com,hola@enclavededanza.com,"951381735,62331615"
Centro de Danza Mari Cruz Alcalá,Valencia,https://www.maricruzalcala.com,,
Ullate Roche,Madrid,https://www.ullateroche.com,,
Guillermina de Bedoya,Madrid,https://www.debedoya.es,,
Irene Viladrich Arbea (Escuela San Ignacio),Navarra,,danza@iesuitaspamplona.org,619813371
